{
  "schema_version": 2,
  "source_format": "legacy-normalized",
  "domain": {
    "id": "axiomas_provisionales",
    "key": "axiomas_provisionales",
    "label": "Axiomas provisionales",
    "source_file": "axiomas_provisionales.json"
  },
  "root": {
    "id": "axiomas_provisionales",
    "canonical_id": "axiomas_provisionales",
    "key": "axiomas_provisionales",
    "label": "Axiomas provisionales",
    "kind": "section",
    "source_path": "axiomas_provisionales",
    "fields": [],
    "collections": [
      {
        "id": "axiomas_provisionales_collection",
        "key": "axiomas_provisionales",
        "label": "Axiomas provisionales",
        "source_path": "axiomas_provisionales",
        "item_kind_hint": "axiom",
        "items": [
          {
            "order_index": 1,
            "value_type": "text",
            "value": "Existe una verdad absoluta que excede toda comprension humana total."
          },
          {
            "order_index": 2,
            "value_type": "text",
            "value": "El ser humano esta orientado hacia esa verdad aunque nunca pueda poseerla plenamente."
          },
          {
            "order_index": 3,
            "value_type": "text",
            "value": "La libertad es la apertura fundamental de la realidad, y el cambio es una de sus expresiones esenciales."
          },
          {
            "order_index": 4,
            "value_type": "text",
            "value": "La exergia mide el margen efectivo de una conciencia o una sociedad para orientarse hacia la verdad y convertir apertura en transformacion real."
          },
          {
            "order_index": 5,
            "value_type": "text",
            "value": "Una orientacion real hacia la verdad absoluta se distingue de una proyeccion refinada de preferencias cuando supera filtros morales intrahumanos, epistemicos, exergicos e historico-temporales."
          },
          {
            "order_index": 6,
            "value_type": "text",
            "value": "Conocer el mecanismo del mundo no implica liberarse; puede servir tambien para dominar."
          },
          {
            "order_index": 7,
            "value_type": "text",
            "value": "El mundo humano genera estructuras de alienacion, poder y repeticion que constituyen la carcel del mundo."
          },
          {
            "order_index": 8,
            "value_type": "text",
            "value": "El demiurgo no es un absoluto cosmico sino una abstraccion estructural de la naturaleza animal humana socializada."
          },
          {
            "order_index": 9,
            "value_type": "text",
            "value": "El bien y el mal no son absolutos cosmicos, pero si categorias objetivas dentro del dominio humano."
          },
          {
            "order_index": 10,
            "value_type": "text",
            "value": "Es malo lo que perpetua conscientemente o estructuralmente el ciclo de ignorancia, dominacion y sufrimiento."
          },
          {
            "order_index": 11,
            "value_type": "text",
            "value": "Es bueno lo que abre capas de verdad, reduce dominacion, protege exergia y favorece trascendencia."
          },
          {
            "order_index": 12,
            "value_type": "text",
            "value": "La autonomia humana no garantiza bondad, pero hace posible una responsabilidad mas real en el uso del poder."
          },
          {
            "order_index": 13,
            "value_type": "text",
            "value": "El poder no es malo en si mismo; se vuelve demiurgico cuando se autonomiza, concentra y deja de estar subordinado a la verdad, la justicia y la autonomia compartida."
          },
          {
            "order_index": 14,
            "value_type": "text",
            "value": "Cualquier persona puede reproducir el ciclo demiurgico si accede a poder y no lo trasciende."
          },
          {
            "order_index": 15,
            "value_type": "text",
            "value": "No todo cambio es exergico; solo lo es aquel que aumenta margen real de reorganizacion y liberacion."
          },
          {
            "order_index": 16,
            "value_type": "text",
            "value": "Toda practica espiritual, politica o intelectual debe juzgarse tambien por sus efectos exergicos reales y por su riesgo de captura."
          },
          {
            "order_index": 17,
            "value_type": "text",
            "value": "Una sociedad puede trascender mediante conocimiento verdadero de la naturaleza y de si misma."
          },
          {
            "order_index": 18,
            "value_type": "text",
            "value": "La liberacion autentica no debe detenerse en individuos o comunidades parciales, sino tender a la emancipacion progresiva del conjunto de la humanidad."
          },
          {
            "order_index": 19,
            "value_type": "text",
            "value": "La humanidad puede convertirse en sujeto historico mas amplio si reduce divisiones ficticias y aumenta su exergia colectiva."
          },
          {
            "order_index": 20,
            "value_type": "text",
            "value": "La expansion cosmica solo es legitima si no reproduce el demiurgo en escala superior."
          },
          {
            "order_index": 21,
            "value_type": "text",
            "value": "El encuentro con otras inteligencias debe orientarse por reciprocidad, humildad ontologica y cooperacion no capturada."
          },
          {
            "order_index": 22,
            "value_type": "text",
            "value": "Ninguna civilizacion posee la verdad absoluta; toda guia legitima solo puede ofrecer aperturas parciales, revisables y no dominadoras."
          }
        ]
      }
    ],
    "children": []
  }
}
