{
  "schema_version": 2,
  "source_format": "legacy-normalized",
  "domain": {
    "id": "preguntas_abiertas",
    "key": "preguntas_abiertas",
    "label": "Preguntas abiertas",
    "source_file": "preguntas_abiertas.json"
  },
  "root": {
    "id": "preguntas_abiertas",
    "canonical_id": "preguntas_abiertas",
    "key": "preguntas_abiertas",
    "label": "Preguntas abiertas",
    "kind": "section",
    "source_path": "preguntas_abiertas",
    "fields": [],
    "collections": [
      {
        "id": "preguntas_abiertas_collection",
        "key": "preguntas_abiertas",
        "label": "Preguntas abiertas",
        "source_path": "preguntas_abiertas",
        "item_kind_hint": "question",
        "items": [
          {
            "order_index": 1,
            "value_type": "text",
            "value": "Como distinguir entre libertad ontologica, libertad consciente y libertad politica sin confundirlas."
          },
          {
            "order_index": 2,
            "value_type": "text",
            "value": "Existe un criterio suficientemente general y operativo para distinguir conocimiento liberador de conocimiento dominador sin reducir esa distincion a una sola variable moral, epistemica o exergica."
          },
          {
            "order_index": 3,
            "value_type": "text",
            "value": "Que practicas concretas permiten trascender."
          },
          {
            "order_index": 4,
            "value_type": "text",
            "value": "Bajo que condiciones las categorias de bien y mal pueden extenderse a otras formas complejas de conciencia no humanas o extraterrestres."
          },
          {
            "order_index": 5,
            "value_type": "text",
            "value": "Como distinguir entre cambios que abren procesos de liberacion y cambios que solo reemplazan una estructura opresiva por otra."
          },
          {
            "order_index": 6,
            "value_type": "text",
            "value": "Como evitar que la auctoritas liberadora derive en dependencia simbolica, culto a la personalidad o nueva forma de captura."
          },
          {
            "order_index": 7,
            "value_type": "text",
            "value": "Cual es la relacion ontologica exacta entre la verdad absoluta, el universo conocido y los posibles supramedios envolventes de lo real."
          },
          {
            "order_index": 8,
            "value_type": "text",
            "value": "Que condiciones minimas hacen emerger espiritu en una conciencia o colectividad, y como distinguirlo de mera acumulacion de informacion o poder simbolico."
          },
          {
            "order_index": 9,
            "value_type": "text",
            "value": "Como medir de forma rigurosa, comparable y no arbitraria la exergia consciente, social e historica sin reducirla a un formalismo vacio."
          },
          {
            "order_index": 10,
            "value_type": "text",
            "value": "Como definir con precision la deuda temporal de una idea, institucion o proceso historico y como incorporarla al juicio exergico y moral."
          },
          {
            "order_index": 11,
            "value_type": "text",
            "value": "Como distinguir entre una apertura real hacia la verdad y una forma colectivamente sofisticada de autoengaño legitimado por exito, cohesion o intensidad historica."
          },
          {
            "order_index": 12,
            "value_type": "text",
            "value": "Que criterios permitirian discernir si una relacion con otras inteligencias aumenta verdad y exergia compartida o reproduce colonizacion, dependencia o captura en escala cosmica."
          },
          {
            "order_index": 13,
            "value_type": "text",
            "value": "Como traducir la moral intrahumana a otras formas de conciencia sin caer ni en relativismo total ni en imperialismo moral humano, construyendo sistemas de traduccion basados en daño, estimulo, apertura, autonomia y cooperacion."
          }
        ]
      }
    ],
    "children": []
  }
}
